itemId,Nama Barang,Harga,Terjual,Review,Rating
8192438461,PUMA Sepatu Slip-On Softride Enzo Evo,999000,0,150,4.966666666666667
8192266089,PUMA Sepatu Sneaker Wanita SOFTRIDE Orla Metallic Dream,999000,0,15,4.866666666666666
7698974295,PUMA Sepatu Lari Aviator,1199000,0,225,4.933333333333334
7698744152,PUMA Jaket Track Scuderia Ferrari Race MT7,2098650,0,37,5.0
8286458988,PUMA Sepatu Training FTR Connect FS,649350,18 sold,12,4.75
8313528156,PUMA Kaos Grafis BMW M Motorsport Motions,799000,0,,
7278644550,PUMA Sepatu Smash Leather Sneakers,999000,336 sold,169,4.893491124260355
8226036911,PUMA Sepatu Sneaker Wanita CA Pro,1124250,0,,
8313428789,PUMA Jaket Tenun Pria,1599000,0,,
8069124153,PUMA Legging Wanita Esensial Logo,307450,0,4,5.0
8009398175,PUMA Kaos Training Pria Performance Cat,246350,0,9,5.0
8192236580,PUMA Sepatu Sneaker Graviton Mega,1099000,0,36,4.972222222222222
8313444681,PUMA Polo Grafis BMW M Motorsport Motions Pria,899000,0,,
8313440727,PUMA Kaos Lengan Panjang Pria PUMA,999000,0,,
8313532119,PUMA Kaus Lari Heather Pria RUN FAVOURITE,729000,0,,
7278828700,PUMA ESS Woven Kids' Cap,135150,44 sold,15,4.866666666666666
7984756441,PUMA Sepatu Basket Court Rider I,2124150,0,15,4.866666666666666
7280246780,PUMA Ransel Wanita Prime Time,419400,0,16,5.0
8313488294,PUMA Kaos Pria Logo Active Small,349000,0,,
8313428791,PUMA Kaos Pria Logo Active Small,239000,0,,
7678954147,PUMA Tas Portable Evo Essentials,449000,0,25,4.88
8164534858,PUMA Anzarun Lite SlipOn,599250,0,49,4.938775510204081
7984576224,PUMA Better Foam Prowl Alt Sepatu Jalan Wanita,1379000,0,51,4.921568627450981
7699194113,PUMA Kaus Wanita Logo Esensial,168350,271 sold,121,4.892561983471074
8313478341,PUMA Tank Pria CLOUDSPUN,599000,0,,
7283096273,PUMA Sandal Leadcat Slide,499000,289 sold,129,4.7984496124031
8313412965,PUMA Kaus Oversized Wanita CLASSICS+,549000,0,,
7698762302,PUMA Kaos Pria PUMA Graphic P,233350,0,723,4.910096818810512
8163230750,PUMA Popcat 20 Shower,424150,0,1,5.0
8313430791,PUMA Kaus Polo Golf Lengan Pendek Wanita CLOUDSPUN Zebra,939000,0,,
8313406998,PUMA PUMA Hijab Women,579000,0,,
7698408904,PUMA Sepatu Training Infusion,1599000,0,38,5.0
8313458524,PUMA Kaos Grafis Bayi Perempuan DOWNTOWN,479000,0,,
7699148204,PUMA Kaos Pria Bergambar PUMA Outline,233350,1.8K sold,905,4.881767955801105
8192420722,PUMA Sepatu Lari Wanita Softride Ruby Luxe,1299000,49 sold,22,5.0
7698986161,PUMA Sepatu Sneakers Wanita Carina Lux,1099000,0,104,4.961538461538462
7698754266,PUMA Legging Wanita Metalik Essentials+,226850,0,32,4.90625
8313440720,PUMA Kaos Bergaris Perempuan Slim CLASSICS,549000,0,,
7697794761,PUMA Sepatu Lari Transport Modern,519350,27 sold,9,5.0
8226040132,PUMA Sepatu Sneakers CA Pro Suede FS,1274250,0,6,5.0
7984762294,PUMA Sepatu Kets Langkah,699500,237 sold,79,4.924050632911392
7984758444,PUMA Sepatu Wanita Kulit Carina,1099000,0,2,5.0
7984774011,PUMA Sepatu Sneakers RS-X Reinvention,1044450,0,2,5.0
8287378641,PUMA Popcat 20 Sandal Bayi Tali Belakang,299000,248 sold,50,5.0
7956398452,PUMA Sepatu Lari Wanita Softride Remi Slip-on Knit,999000,0,69,4.9855072463768115
8286472942,PUMA Fusion Crush Sport Golf Shoes Youth,939000,0,,
7282508845,PUMA Sepatu Lari Flyer,799000,0,76,4.842105263157895
7678918264,PUMA Sepatu Lari Flyer Flex Platinum Gray-Rose Dust-PUMA White,899000,0,72,4.958333333333333
8286742321,PUMA Sepatu Lari Transport Modern,799000,11 sold,5,5.0
7914090869,PUMA Sepatu Lari NRGY Comet,899000,0,41,4.951219512195122
8009082926,PUMA Sepatu Sneaker Slip-On Anzarun Lite,799000,481 sold,145,4.958620689655173
7956406434,PUMA Sandal Selop Shibui,899000,0,,
7699892256,PUMA Sepatu Training Wanita Disperse XT 3,714350,0,1,5.0
8009290663,PUMA Anzarun Lite Sneakers,799000,0,,
8154570342,PUMA Sepatu Lari Street Enzo 2 Unisex,899000,0,7,5.0
7914352534,PUMA Sepatu Trainer R22,1299000,0,23,4.913043478260869
7956386556,PUMA Shuffle Sneakers,749250,0,144,4.958333333333333
7914124884,PUMA Sepatu Lari Flyer,799000,0,67,4.955223880597015
8009284689,PUMA Anzarun Lite Sneakers,799000,0,,
8287280854,PUMA Sepatu Golf Disc Pria Shadowcat NITRO™,2299000,0,,
8287514818,PUMA Slide Wanita Cool Cat 2.0 BX,408850,0,,
8287422085,PUMA Enzo 2 Clean Unisex Running Shoes,999000,5 sold,3,5.0
8287550510,PUMA teamGOAL Football Gym Sack,199000,0,,
7698992033,PUMA Sepatu Varion II Indoor Sports,999000,0,3,5.0
8287358845,PUMA Sepatu Golf Pria Fusion Crush Sport,1449000,0,,
7956442004,PUMA Sepatu Lari Resolve Modern,674250,0,3,5.0
7984714886,PUMA Sepatu Sneakers Shuffle Perforated,999000,22 sold,11,5.0
8163178157,PUMA Transport,649350,0,1,5.0
7700118371,PUMA Tas Bahu PUMA Phase Portable,161850,0,140,4.9071428571428575
8286752290,PUMA Sepatu Golf Electrocat NITRO™,2299000,0,,
7698884988,PUMA Tas Ransel Kecil PUMA Phase,359000,0,8,4.625
8008942528,PUMA Sepatu Sneaker Anak-anak Carina 2.0 Holo,749250,0,,
8287424021,PUMA Sepatu Golf Pria Avant,2099000,0,,
8009480033,PUMA Sepatu Sneaker Anak-anak PUMA x ONE PIECE Suede,1172150,0,,
8287538442,PUMA Sandal Basket MB.03,519350,0,,
7280058265,PUMA Tas Ransel Wanita Time Minime,419400,0,24,4.916666666666667
7698426575,PUMA Sepatu Sneaker Wanita Cali Dream Clean,1104350,0,3,5.0
8193522157,PUMA Topi Ember PUMA SQUAD,459000,0,2,5.0
8287532499,PUMA Sandal Basket MB.03,519350,0,,
8154552395,PUMA Sneaker lari uniseks SOFTRIDE Flex Vital,1299000,0,1,5.0
8313408986,PUMA Atasan Wanita Ritsleting Pendek PUMA RUN CLOUDSPUN,1199000,0,,
7984714888,PUMA Sepatu Sneaker Rebound V6 Low,824250,0,,
7697992025,PUMA Sepatu Training Smash Vulcanised V3 Low,999000,0,19,4.7894736842105265
7697836910,PUMA Sepatu Training Smash Vulcanised V3 Low,999000,0,15,4.666666666666667
7679630407,PUMA Sandal Popcat 20 Puma White-Puma Black,499000,0,7,5.0
8287560274,PUMA Popcat 20 Backstrap Kids' Sandals,359000,53 sold,10,5.0
7678890656,PUMA Sepatu Skye Women's Trainers Whisper White-Yellow Pear-Blue Glow-Cloud Pink,1099000,0,49,4.938775510204081
7678910386,PUMA Sandal Leadcat Slide black-white,499000,177 sold,57,4.912280701754386
8287542665,PUMA Phase Backpack No. 2,399000,0,4,5.0
7984752591,PUMA Sandal Unisex Popcat 20 GirlPower,424150,0,8,4.75
8193630069,PUMA Kaos Pria Logo ESS,220150,0,,
7956430048,PUMA Sepatu Lari Flyer Lite,679150,0,25,4.88
8192420710,PUMA Sepatu Sepak Bola Remaja FUTURE 7 PLAY FG/AG,799000,0,8,5.0
8286722366,PUMA x NEYMAR JR FUTURE 7 MATCH FG/AG Football Boots,1124250,0,22,4.954545454545454
8193530002,PUMA Topi III Esensial,199000,0,13,4.923076923076923
8287994266,PUMA Jaket Hoodie Wanita Essentials Full-Zip,560150,0,12,4.5
7699240016,PUMA Kaus Wanita Logo Kecil Esensial,155350,0,74,4.945945945945946
7280240866,PUMA Ransel Wanita Prime Time Minime,419400,53 sold,12,5.0
7699150227,PUMA Kaus Pria Logo Esensial,200850,0,109,4.761467889908257
8288906229,PUMA Jaket Hoodie Pria Essentials Small Logo Full-Zip,560150,80 sold,27,4.962962962962963
7678892614,PUMA Sepatu Trainer Caracal Puma White-Puma Black-Gray Violet,1099000,0,37,4.864864864864865
8287516969,PUMA Bola Sepak Prestige,269250,7 sold,2,5.0
7699138257,PUMA Kaus Polo Pria Pique Esensial,246350,0,409,4.885365853658537
8192420712,PUMA Softride Flex Knit Men's Slip-On Shoes,899000,0,47,4.958333333333333
7699230060,PUMA Kaus Wanita Berlogo Metalik Essentials+,168350,0,59,4.8474576271186445
8192450238,PUMA Sepatu Lari Scend Pro,899000,164 sold,60,4.933333333333334
8286738322,PUMA Sepatu Sepak Bola FUTURE 7 PLAY FG/AG,999000,0,7,4.857142857142857
7698774297,PUMA Kaus Kaki PUMA Unisex Quarter 3 Pasang,126650,140 sold,65,4.953846153846154
7956386575,PUMA Sepatu Sneakers Bari Casual Canvas,999000,324 sold,155,4.929032258064516
8192424779,PUMA Sepatu Lari Scend Pro,899000,24 sold,6,5.0
8288890294,PUMA Kaos Wanita Berlogo Metalik Essentials+,220150,13 sold,3,5.0
8111754128,PUMA Sepatu Sepak Bola Remaja FUTURE 7 PLAY FG/AG,799000,0,6,5.0
8193514256,PUMA Tas Tote Mini Core Up,499000,0,12,4.916666666666667
8192450215,PUMA Softride Flex Knit Men's Slip-On Shoes,899000,0,34,4.882352941176471
7442020779,PUMA Sepatu Lari Retaliate 2 High Risk Red-Puma Black,1299000,0,30,4.733333333333333
7956416273,PUMA Sepatu Lari Better Foam Legacy,934150,0,12,5.0
8286696789,PUMA Romantis Cilia Regent Sepatu Kets Wanita,733850,14 sold,5,4.8
7678880985,PUMA Sandal Leadcat 2.0 Suede OG PUMA Black-PUMA White-Metallic Gold,679150,0,3,5.0
8191024315,PUMA Sepatu Sneakers Ever FS,899000,34 sold,19,4.7894736842105265
8193512622,PUMA Ransel teamGOAL,399000,16 sold,6,4.666666666666667
8111720551,PUMA Wave Mule,494250,0,2,5.0
8232774996,PUMA Kaus Kaki Seperempat Unisex 3 Paket,149250,5 sold,2,5.0
7984710976,PUMA Sepatu Sneaker Wanita Slipstream PRM,934450,0,2,5.0
8192412827,PUMA Softride Flex Knit Men's Slip-On Shoes,899000,0,101,4.9405940594059405
8193530383,PUMA Tas Pinggang PUMA Style,399000,0,2,5.0
8232650331,PUMA Kaos BMW M Motorsport Calder,679150,0,1,5.0
8225918215,PUMA Sepatu Sneaker Wanita Cali Dream Dalmatian,1124250,0,,
8008298994,PUMA Kemeja Kitten Pria DOWNTOWN,549450,0,1,4.0
8193588558,PUMA Kaus Statement Pria Berlogo BMW M Motorsport,679150,0,,
8287542663,PUMA Training Essential Premium Gloves,559000,0,,
7679620553,PUMA Sepatu Sneaker Slipstream Bball PUMA White-Archive Green,934450,22 sold,13,4.846153846153846
8192268083,PUMA Sepatu Sneaker Anak-anak PUMA Smash 3.0 Badges,659000,0,,
8192448222,PUMA Sepatu Sneakers Anak-anak Anzarun Lite,629000,0,7,5.0
8260778172,PUMA Kaus Kaki Seperempat Paket 2 untuk Remaja,96750,0,,
8286486881,PUMA Sandal Anak-Anak Cool Cat 2.0,399000,0,,
7984764306,PUMA Sepatu Sneaker Unisex Ferrari Suede,1027950,0,3,5.0
8287542460,PUMA Sepatu Sneakers Youth All-Day Active,611150,0,1,5.0
7984756439,PUMA Sepatu Kets Wanita Mayze Mix,989450,0,2,4.5
8286572023,PUMA Sepatu Sneakers Anak-Anak All-Day Active Alternative Closure,594150,0,,
7283078408,PUMA Kaus Training Wanita Favourite Heather Cat,359400,0,1,5.0
7984764305,PUMA Sepatu Sneaker Unisex Hypnotic Metallic Shine,899250,0,3,5.0
8287516772,PUMA Sepatu Kets Velophasis Born In The 2000s,1899000,0,,
8192268088,PUMA Sandal Wanita Popcat 2.0 Coquette,499000,0,,
8287538644,PUMA Topi Fundamentals,199000,0,1,5.0
8232530483,PUMA Sweatpant Wanita DOWNTOWN Relaxed,714350,0,,
7698896906,PUMA Sarung Tangan Penjaga Gawang PUMA ULTRA Play RC,219450,0,,
8287560284,PUMA Sepatu Dribble,1199000,0,,
8232762110,PUMA Kaos Santai TEAM,324350,0,1,5.0
8286698803,PUMA Sandal Anak-Anak Cool Cat 2.0,399000,0,,
8164666886,PUMA Running Visor,259000,6 sold,2,5.0
8069102376,PUMA Kaus Polo Pria Scuderia Ferrari Team,999000,0,5,5.0
8192416747,PUMA Sepatu Lari Night Runner V3,799000,0,8,5.0
8286724559,PUMA R78 Summer Camp Kids' Sneakers,747150,0,,
8286480940,PUMA Sandal Youth Cool Cat 2.0,399000,0,1,5.0
8286518564,PUMA Sandal Anak-Anak Cool Cat 2.0,399000,0,,
8287560275,PUMA Evolve AC Sandals Kids,559000,0,,
7956392541,PUMA Sepatu Lari Pria Velocity NITRO™ 3,1964250,0,,
8287538633,PUMA Legging Wanita Metalik Essentials+,296650,0,1,5.0
7341510799,PUMA Running Cap III,259000,0,147,4.870748299319728
8192416746,PUMA Sepatu Lari Night Runner V3,799000,0,5,5.0
8193526039,PUMA Topi Flatbrim ESS No. 1,399000,0,,
8193524293,PUMA Topi Bucket Essentials Logo,459000,0,,
7278660348,PUMA Topi III Esensial,199000,98 sold,46,4.913043478260869
7956436832,PUMA Topi Metal Cat,305150,0,6,4.833333333333333
8260612674,PUMA Kaus Pria Berlogo Kecil CLASSICS,349000,0,,
8286566099,PUMA Pelatih Remix Lay Up Rebound,674250,0,1,5.0
8193518192,PUMA Tas Olahraga Medium Fundamentals,559000,0,,
8260696226,PUMA Topi Lari Esensial,199000,0,,
8149966367,PUMA Sweatpant Remaja Berlogo Essentials,449000,0,1,5.0
8287540647,PUMA PR Running Waistband,559000,0,,
7984720974,PUMA Sepatu Basket Genetics,1124250,7 sold,4,5.0
7846872609,PUMA Topi Fundamentals,199000,6 sold,2,5.0
8111758231,PUMA Kaus Wanita Logo Kecil Esensial,155350,0,5,5.0
7984716987,PUMA FENTY x PUMA Creeper Phatty Sepatu Unisex,1399300,0,2,5.0
8164594454,PUMA Anzarun Lite,799000,0,,
8286472907,PUMA Sepatu Golf Wanita Fusion Crush Sport,1359000,0,,
8162406083,PUMA Anzarun Lite SlipOn,799000,0,45,4.933333333333334
7956546837,PUMA Sweatpant Remaja PUMA SQUAD,389350,0,2,5.0
8287516963,PUMA Topi III Esensial,199000,0,,
8287554291,PUMA FENTY x Creeper Phatty Earth Tone Sneakers Anak-anak,769300,0,,
7698320967,PUMA Topi Porsche Legacy,475150,0,1,5.0
8193522167,PUMA Ransel PUMA Phase II,459000,0,5,4.8
8193516225,PUMA Tas Shopper Core Base,359000,12 sold,6,5.0
7956584165,PUMA Hoodie Remaja Active Sports Full-Zip,519350,0,16,4.875
7987854041,PUMA Kaos Bergambar PUMA LEGACY,395450,0,2,5.0
8162326160,PUMA Softride Harmony Slip Wns,1099000,0,,
8193858065,PUMA Hoodie Anak ESS+,499000,0,1,5.0
7984552689,PUMA Sepatu Lari Aviator,1199000,0,26,4.851851851851852
8232656718,PUMA Celana Pendek BETTER CLASSICS,384450,0,3,5.0
8286492669,PUMA Sandal Uniseks BMW M Motorsport Leadcat 2.0,759000,0,,
8286736382,PUMA Flyer Runner V Seepatu Sneakers anak-anak,594150,0,4,5.0
8260582805,PUMA Hoodie Anak PUMA x TROLLS,699000,0,1,5.0
8009292649,PUMA Sepatu Sneaker Anak-anak PUMA x TROLLS Caven 2.0,749250,0,,
8193516237,PUMA Ransel PUMA S,559000,0,2,4.5
8286738381,PUMA Sepatu Lari Uniseks Ease In SOFTRIDE Carson,899000,0,1,5.0
7441490539,"PUMA Celana Pendek Mesh Pria PUMA Team 8""",569400,0,2,5.0
8008316966,PUMA Jaket Pria Downtown,844350,0,,
8260766866,"PUMA Celana Pendek Ketat Wanita HYPERNATURAL 5""",729000,0,,
7956554526,PUMA Hoodie Anak-anak PUMA x TROLLS,384450,0,2,5.0
7341522486,PUMA Topi Fundamentals,169150,0,9,4.777777777777778
8287612009,PUMA KAUS KAKI UNISEX Sneakers 3P,135150,0,1,5.0
8286742359,PUMA Sandal Leadcat FTR Comfort,699000,0,,
8286736526,PUMA Rebound Abrupt Sneakers Unisex,1299000,16 sold,2,5.0
7679642143,PUMA Sepatu Sneaker Bari Casual Canvas PUMA White-PUMA Navy-Vapor Gray,649350,0,39,4.871794871794871
8287554501,PUMA Deker Tangan berbahan terry inti yang bernilai,159000,0,,
8193604387,PUMA Celana Training Performance Woven 5” untuk Pria,499000,0,,
8009278645,PUMA Sepatu Sneaker Anak-anak PUMA x PLAYSTATION RS-X,824250,0,1,5.0
7956516072,PUMA Topi Remaja Metal Cat,259000,30 sold,13,5.0
8286552196,PUMA Sepatu Golf Pria IGNITE Innovate,2829000,0,,
8192204990,PUMA Sepatu Sneaker RBD Game Low,1299000,0,1,5.0
7984772043,PUMA FENTY x PUMA Creeper Phatty Sepatu Kets Anak Perempuan,769300,0,,
8154552520,PUMA Sepatu Lari Extend Lite Trail,1099000,0,10,4.6
8286730511,PUMA Sepatu Sneakers Remaja Carina 2.0 Crystal Wings,733850,0,,
8009326488,PUMA Sepatu Sneaker Anak-anak PUMA x ONE PIECE Suede,1172150,0,,
7987856007,PUMA Kaos Pria Logo PUMA,259350,0,2,3.0
8287600122,PUMA Lurex Women's Knee-High Socks,84150,0,,
8287606108,PUMA Bra Olahraga 4KEEPS,499000,0,1,5.0
8286750269,PUMA Sepatu Golf x PALM TREE CREW Electrocat NITRO™,2509000,0,,
7956538941,PUMA Sweatpant Remaja ESS+ Mid 90s,389350,0,5,5.0
8009042257,PUMA Sepatu Slip-On Anak-anak SOFT Enzo Evo,599250,0,1,5.0
7698714371,PUMA Celana Pendek Jersey Pria Esensial 10Inci,226850,0,35,4.885714285714286
8286752287,PUMA Sepatu Lari Hyperdrive PROFOAM SPEED,974350,0,,
8193514251,PUMA Tas X-Body Core Pop,399000,0,3,5.0
8164560777,PUMA Transport,649350,0,,
8287514820,PUMA Sepatu Sneakers Rebound V6 Low,1099000,0,,
7956530533,"PUMA Celana Pendek Lari Wanita RUN ULTRAWEAVE VELOCITY 3""",779350,0,,
7984754445,PUMA Sepatu Sneaker Slipstream Everywhere,1019400,0,0,5.0
7984756437,PUMA Sepatu Olahraga Wanita PWR NITRO™ SQD,1574250,0,,
7678904322,PUMA Tas Sepatu PUMA Challenger,259000,0,2,5.0
7342170126,PUMA Smash v2 Youth Sneakers Puma Black-Puma Black,560150,0,72,4.819444444444445
8192262015,PUMA Sandal Youth PUMA Evolve,599000,0,2,5.0
8193522184,PUMA Ransel Core Pop,459000,0,1,5.0
8287602094,PUMA Men's Sneakers Cushioned Sock 1 pack,84150,0,,
7698718266,PUMA Sweatshirt Ristleting Pendek Wanita PUMA TEAM,857450,0,3,5.0
7283138983,PUMA Sepatu Smash v2 Sneakers,699000,0,225,4.986666666666666
8111736300,PUMA Sandal Leadcat 2.0,499000,0,,
7441474700,PUMA Celana Pendek Pria Fandom,791400,0,1,5.0
8286490749,PUMA Sepatu Kets RS-X Efekt PRM,1169350,0,,
7280054915,PUMA Topi Metal Cat,359000,0,50,4.88
8193522624,PUMA Tas Pinggang Evo ESS,399000,0,6,5.0
8192416763,PUMA Sepatu Lari Reflect Lite,899000,0,49,4.8979591836734695
7283504266,PUMA Sepatu Bari Sneakers,479400,0,45,4.911111111111111
8192412909,PUMA Sepatu Sepak Bola Remaja ULTRA 5 PLAY FG/AG,799000,0,7,5.0
7698744300,PUMA Celana Pria Jersey Esensial,226850,120 sold,67,4.91044776119403
8192236710,PUMA Sepatu Sneaker Unisex Cilia Mode Coquette,899000,0,8,5.0
8192440365,PUMA Sepatu Lari Retaliate 2,1299000,0,13,5.0
7697758975,PUMA Sepatu Training Pria PWRFrame TR 2,1236950,0,29,4.9655172413793105
8190962360,PUMA Sepatu Sneaker Ever FS,899000,107 sold,61,4.983606557377049
7338030361,PUMA Deck Gym Sack II,299000,52 sold,26,5.0
8193516234,PUMA Tas Tote Mini Core Fur,599000,0,2,5.0
7956538106,PUMA Tas Olahraga Kecil Fundamentals,459000,0,3,5.0
7956570165,PUMA Kaus Pria Scuderia Ferrari Heritage,649350,70 sold,39,4.923076923076923
8192410896,PUMA Sepatu Lari Slip-On Wanita SOFTRIDE Pro Echo,1099000,0,8,4.875
8260668726,PUMA Tas Pinggang Classics LV8 PU,459000,0,1,5.0
8190962629,PUMA Sepatu Sneaker Smash 3.0 L,899000,70 sold,25,4.84
7431188237,PUMA Topi Flat Brim,449000,0,113,4.929203539823009
7699124346,PUMA Kaus Pria Logo Kecil Esensial,155350,0,295,4.867796610169491
7984756436,PUMA Sepatu Sepak Bola Pria FG/AG FUTURE PLAY,1249000,0,9,4.888888888888889
7698410849,PUMA Sepatu Sneaker Caven Tape,999000,61 sold,20,4.85
8286490708,PUMA Sepatu Lari Wanita SOFTRIDE Sophia 2Slip Chrome,1124250,0,3,5.0
7984772037,PUMA Sepatu Lari Wanita ForeverRun NITRO™,2159250,0,,
7609046845,PUMA Sepatu Sneakers Wanita Tori,899000,0,14,5.0
8154568376,PUMA Sepatu Sneaker Bari Casual Canvas,999000,68 sold,34,4.911764705882353
8287956486,PUMA Kaos Pria Logo ESS No.1,262650,15 sold,2,5.0
8287538645,PUMA ATTACANTO Football,299000,0,1,5.0
8191008480,PUMA Sepatu Sneaker Anzarun FS Renew,1099000,0,7,5.0
8192248123,PUMA Sepatu Sneakers Wanita Tori,899000,0,3,5.0
8009464039,PUMA Kaos Pria Logo Kecil Esensial,220350,38 sold,16,4.9375
7956414274,PUMA Sandal Leadcat 2.0,499000,0,13,5.0
8286736366,PUMA FUTURE 7 Match Rush Men's TT Football Boots,1124250,5 sold,1,5.0
7698694550,PUMA Kaus Lengan Panjang Wanita Esensial,233350,0,44,4.954545454545454
7443702493,PUMA Kaus Desain Gambar Multicolour untuk Wanita,281400,0,10,5.0
8192246297,PUMA Sepatu Sneaker Wanita Rebound V6 Low Coquette,1099000,0,6,5.0
8069114281,PUMA Sepatu Remaja Scuderia Ferrari Drift Cat Decima Motorsport,746850,5 sold,1,4.0
7984554693,PUMA KAUS KAKI PUMA UNISEX SNEAKER 3P,135150,0,98,4.877551020408164
7278808975,PUMA Sandal Popcat 20,499000,0,73,4.863013698630137
7257234231,Puma Botol Latihan Gym,254150,0,15,4.8
8193604453,PUMA Kaos Wanita Logo Kecil Esensial,203150,0,,
7608222314,PUMA Sandal Leadcat Slide,499000,0,24,4.875
7678914464,PUMA Sepatu Twitch Runner Trail PUMA Black-Chili Powder,1499000,15 sold,9,5.0
7698466431,PUMA Sepatu Youth Evolve Slip On,569400,0,2,5.0
8192410904,PUMA Sepatu Sneakers Anzarun Grid,1199000,0,11,5.0
7283684620,PUMA Phase Backpack No. 2,399000,0,115,4.895652173913043
8286740402,PUMA Sepatu Sneakers All Day Active,584350,11 sold,4,5.0
7698702489,PUMA Celana Pendek Sweat Pants Pria,389350,11 sold,4,5.0
8193524174,PUMA Ransel Bertudung PUMA PHASE,559000,0,5,5.0
7698663000,PUMA Kaos Scuderia Ferrari Race MT7,679150,33 sold,12,4.833333333333333
8191012878,PUMA Sepatu Sneaker Caven Mix,1199000,0,39,4.871794871794871
7698922590,PUMA Sepatu Smash Leather Sneakers,1199000,14 sold,9,5.0
7338012540,PUMA Tas Pinggang Performance Running Classic,459000,0,39,4.6923076923076925
8193842914,PUMA Kaus Pria ESS + LOGO LAB Cat,399000,10 sold,1,5.0
8192424764,PUMA Sepatu Lari Uniseks Ease In SOFTRIDE Carson,899000,0,3,5.0
7679636299,PUMA Sepatu Trainer Caracal White-Black,1099000,0,53,4.886792452830188
8009246787,PUMA Kaos Pria Essentials,265850,0,16,4.9375
8154562407,PUMA Sepatu Sneaker Bari Casual Canvas,999000,0,18,5.0
7956492732,PUMA Ransel PUMA Deck,699000,0,20,4.95
7282336614,PUMA Topi Lari Ringan,359000,0,23,4.958333333333333
7278710008,PUMA Sarung Tangan Latihan Gym Wanita,359000,0,2,4.5
8192438457,PUMA Sepatu Sneakers Anzarun Grid,1199000,0,15,4.933333333333334
8286718498,PUMA Sepatu Skye Women's Sneakers,1099000,0,1,5.0
8193512323,PUMA Ransel PUMA Academy,559000,0,7,5.0
8192448220,PUMA Sepatu Sneakers Axis Plus 90s,1249000,0,17,4.9411764705882355
7679624483,PUMA Sandal Popcat 20 Inky Blue-PUMA White,499000,0,17,4.647058823529412
8193592989,PUMA Kaos Wanita Logo Essentials,220150,0,,
7700540871,PUMA Kaus Training Pria Train Concept Graphic,329450,0,8,4.875
7956512276,PUMA Ransel PUMA Phase II,459000,0,14,4.928571428571429
7956490891,PUMA Ransel PUMA Plus,459000,0,24,5.0
8286734561,PUMA Sepatu kets Club Suede,1199000,0,2,5.0
8193856827,PUMA Celana Lurus Wanita HER,1099000,0,3,5.0
8286982646,PUMA Sepatu Sepak Bola Remaja FUTURE 7 PLAY FG/AG,599250,0,1,4.0
7914096859,PUMA Sepatu Sepak Bola Pria ULTRA PLAY FG/AG,811850,15 sold,8,5.0
7698970350,PUMA Sandal Popcat 20,339150,132 sold,71,4.915492957746479
8009398178,PUMA Kaos Lari Wanita Lengan Pendek Favourite,311350,0,7,5.0
8009128946,PUMA Kaos Training Pria Performance Cat,272350,0,11,4.636363636363637
7699908238,PUMA Sepatu Training CA Pro Classic Youth,934150,0,,
7697770888,PUMA Sepatu Training Wanita PWRFrame TR 2,1236950,0,1,5.0
8193636007,PUMA Kaos Pria GRAFIS Ikon,339150,0,,
7698130442,PUMA Sepatu Sneaker Wanita Cali Dream Leather,1784250,0,15,4.8
8192416755,PUMA Sepatu Lari X-Cell Action,1499000,0,6,4.833333333333333
8286484782,PUMA Sepatu Sepak Bola FUTURE 7 PLAY FG/AG,999000,0,1,5.0
8192222894,PUMA Sepatu Sneaker RBD Game Low,1299000,0,2,5.0
8009056986,PUMA Sepatu Sneaker Anak-anak PUMA x ONE PIECE Suede,1172150,0,,
8192222971,PUMA Sepatu Sneaker Suede Milenio Tech,1299000,0,3,5.0
8009124858,PUMA Sepatu Sneaker Anak-anak PUMA x ONE PIECE Suede,1172150,0,1,5.0
8009184718,PUMA Sepatu Sepak Bola Pria FUTURE 7 MATCH IT,1499000,0,,
8286718463,PUMA Ferrari RS-X Unisex Sneakers,1686750,0,,
7342588787,PUMA Sepatu Lari Aviator ProFoam Sky Lime Squeeze-Puma White-Puma Black,1399000,0,54,4.907407407407407
8164706723,PUMA SHOE CARE Cleaner,169150,0,,
8260784365,"PUMA Celana Pendek Ketat 6"" Wanita PUMA RUN Ultraform",999000,0,,
8287564209,PUMA FENTY x Creeper Phatty Earth Tone Sneakers Anak-anak,769300,0,,
8260596982,PUMA Kaos Klasik Pria,499000,0,,
7441534016,PUMA Kaus Wanita Classics Slim,407150,0,3,5.0
8287390583,PUMA Sepatu Lari Rajut Uniseks SOFTRIDE Carson,999000,0,,
8287538684,PUMA ESS Trucker Cap,359000,0,1,5.0
8287360790,PUMA Sepatu Golf Pria Fair Isle Phantomcat NITRO™,2509000,0,,
8260702678,PUMA Tas Jinjing ESS,599000,0,,
8260588791,PUMA Celana Kargo Anak PUMA x TROLLS,599000,0,,
8260740965,"PUMA Celana Pendek Lari Wanita RUN FAV VELOCITY 5""",729000,0,,
8286758053,PUMA SOFTRIDE Stakd Premium Women's Running Shoes,1299000,0,,
8193594644,PUMA Sweatshirt Wanita BETTER ESSENTIALS,999000,0,,
8287510854,PUMA Sepatu Sneakers Unisex Palermo Players Lane,1699000,0,1,5.0
7698340639,PUMA Ikat Kepala Latihan Esensial,159000,0,1,5.0
8009392139,PUMA Kaos Training Pria Performance Cat,246350,0,22,4.636363636363637
8260600667,"PUMA Celana Pendek Lari Pria RUN VELOCITY ULTRAWEAVE 5""",999000,0,,
7956414267,PUMA Sepatu Lari X-Cell Action,1499000,0,31,4.838709677419355
8287558290,PUMA Sepatu Sneakers Morphic,1399000,0,,
7846944313,PUMA KAUS KAKI PUMA UNISEX FOOTIE 3P,177650,0,1,5.0
7678892585,PUMA Sandal Leadcat Slide Pastel Parchment-Bridal Rose,499000,62 sold,18,5.0
8287352935,PUMA Sepatu Golf Pria Golf IGNITE Innovate dengan Soft Spike,2929000,0,,
7956522939,PUMA Celana Pendek Remaja Active Sports,534650,0,,
8260780620,PUMA Celana Ketat Wanita PUMA RUN Microfleece,1299000,0,,
8192248146,PUMA Sepatu Sneaker RBD Game Low,1299000,0,1,5.0
8287414283,PUMA Sepatu Golf Wanita Avant,1989000,0,,
8193520189,PUMA Ransel Core College,659000,0,4,4.75
8193586594,PUMA Celana Pendek Pria Essentials+ Two-Tone,499000,0,1,5.0
7698974218,PUMA ESS Woven Kids' Cap,135150,6 sold,2,5.0
8192242221,PUMA Sepatu Sneaker Rebound V6 Low,1099000,0,,
8009376285,PUMA Sepatu Sneaker Anak-anak PUMA x TROLLS Caven 2.0,749250,0,,
7956530680,PUMA Crop Top Lari Wanita RUN ULTRASPUN,549450,0,,
7956428068,PUMA Sandal Popcat 20,424150,0,5,4.8
7280312167,PUMA Tas Deck Crossbody,344250,0,39,4.897435897435898
8193514254,PUMA Ransel Mini-Me Core Up,559000,0,4,5.0
8193530052,PUMA Ransel PUMA PHASE Elemental,459000,0,2,5.0
8069112343,PUMA Atasan Training Pria Football,679150,0,10,5.0
8286694786,PUMA Sandal Anak-Anak Cool Cat 2.0,399000,0,,
7698966348,PUMA Ransel Deck,699000,0,3,5.0
8287540687,PUMA Topi Mercedes AMG Motorsport,659000,0,,
7441544609,PUMA Celana Pendek Training Tenun Elastis Pria PUMA Fit 7,437400,0,9,5.0
7698696503,PUMA Sweatshirt Anak-Anak Classics Mix Match,466950,0,0,5.0
8192240327,PUMA Sepatu Lari Slip-On Wanita SOFTRIDE Harmony,1099000,0,,
8260650509,PUMA Sepatu Anak PUMA x Trolls Carina Street,899000,0,,
8009290615,PUMA Sepatu Sneakers Anak-anak Rebound Lay-Up Lo V,659250,0,1,5.0
7700092570,PUMA Kaos Indonesia Basketball World Championships 2023,311350,0,13,5.0
7956534497,"PUMA Celana Pendek Olahraga Pria 7"" Stretch Woven",551850,0,0,5.0
8009432106,PUMA Sandal Leadcat 2.0,499000,0,,
8193518211,PUMA Tas Jinjing Mini Core Up,499000,0,4,5.0
7342144311,PUMA Selop SWxP Leadcat 2.0 Puma White-Puma Black-Tangerine,527400,0,2,5.0
7956406408,PUMA Sepatu Olahraga Wanita Disperse XT 3 Summer Daze,896350,0,,
8193510936,PUMA Tas Duffle Gym Medium,829000,0,2,5.0
8193594651,PUMA Kaus Pria RAD/CAL,499000,0,3,5.0
8193516221,PUMA Tas Belanja Campus,699000,0,1,5.0
8226078667,PUMA Sandal Wanita Karmen Slide Puffy Animetal,599250,0,1,5.0
8260790353,PUMA Celana Ketat 7/8 Pinggang Tinggi Wanita HYPERNATURAL,1099000,0,,
8286694847,PUMA Sandal Wanita Popcat 2.0 Coquette,499000,0,,
8193512332,PUMA Ransel PUMA Patch,559000,0,1,5.0
8286542373,PUMA Sepatu Scuderia Ferrari X-Ray Speed Motorsport,1499000,0,1,5.0
8193582798,PUMA Kaus Pria Bergambar Porsche Legacy 911,799000,0,,
8287616004,PUMA Ransel Phase II,298350,0,1,4.0
